[
  {
    "key": "search",
    "label": "Search",
    "type": "search",
    "options": [],
    "appliesTo": [
      "auto_actions",
      "execution_log",
      "approval_queue",
      "runtime_incidents",
      "feature_flags",
      "runtime_limits",
      "module_health",
      "performance_budgets",
      "runtime_guard_policies"
    ]
  },
  {
    "key": "module",
    "label": "Module",
    "type": "multi_select",
    "options": [
      {
        "label": "Schedule",
        "value": "schedule"
      },
      {
        "label": "Cases",
        "value": "cases"
      },
      {
        "label": "Chat",
        "value": "chat"
      },
      {
        "label": "Notifications",
        "value": "notifications"
      },
      {
        "label": "Keys & Alarm",
        "value": "keys_alarm"
      },
      {
        "label": "Customer Card",
        "value": "customer_card"
      },
      {
        "label": "Work Orders",
        "value": "work_orders"
      },
      {
        "label": "Invoices",
        "value": "invoices"
      },
      {
        "label": "Media",
        "value": "media"
      },
      {
        "label": "Time Bank",
        "value": "time_bank"
      },
      {
        "label": "Agreements",
        "value": "agreements"
      },
      {
        "label": "Employees",
        "value": "employees"
      },
      {
        "label": "System",
        "value": "system"
      }
    ],
    "appliesTo": [
      "auto_actions",
      "module_coverage",
      "execution_log",
      "approval_queue",
      "runtime_incidents",
      "feature_flags",
      "runtime_limits",
      "module_health",
      "performance_budgets",
      "runtime_guard_policies"
    ]
  },
  {
    "key": "status",
    "label": "Action status",
    "type": "multi_select",
    "options": [
      {
        "label": "draft",
        "value": "draft"
      },
      {
        "label": "planned",
        "value": "planned"
      },
      {
        "label": "active",
        "value": "active"
      },
      {
        "label": "disabled",
        "value": "disabled"
      },
      {
        "label": "deprecated",
        "value": "deprecated"
      }
    ],
    "appliesTo": [
      "auto_actions"
    ]
  },
  {
    "key": "riskLevel",
    "label": "Risk level",
    "type": "multi_select",
    "options": [
      {
        "label": "low",
        "value": "low"
      },
      {
        "label": "medium",
        "value": "medium"
      },
      {
        "label": "high",
        "value": "high"
      },
      {
        "label": "critical",
        "value": "critical"
      }
    ],
    "appliesTo": [
      "auto_actions",
      "execution_log",
      "approval_queue",
      "runtime_guard_policies"
    ]
  },
  {
    "key": "executionMode",
    "label": "Execution mode",
    "type": "multi_select",
    "options": [
      {
        "label": "observe_only",
        "value": "observe_only"
      },
      {
        "label": "auto_execute_with_log",
        "value": "auto_execute_with_log"
      },
      {
        "label": "auto_execute_with_notification",
        "value": "auto_execute_with_notification"
      },
      {
        "label": "requires_admin_review",
        "value": "requires_admin_review"
      },
      {
        "label": "requires_company_admin_approval",
        "value": "requires_company_admin_approval"
      },
      {
        "label": "requires_super_admin_approval",
        "value": "requires_super_admin_approval"
      },
      {
        "label": "blocked",
        "value": "blocked"
      }
    ],
    "appliesTo": [
      "auto_actions"
    ]
  },
  {
    "key": "supportsAi",
    "label": "Supports AI",
    "type": "boolean",
    "options": [
      {
        "label": "Yes",
        "value": true
      },
      {
        "label": "No",
        "value": false
      }
    ],
    "appliesTo": [
      "auto_actions"
    ]
  },
  {
    "key": "aiEnabled",
    "label": "AI enabled",
    "type": "boolean",
    "options": [
      {
        "label": "Yes",
        "value": true
      },
      {
        "label": "No",
        "value": false
      }
    ],
    "appliesTo": [
      "auto_actions",
      "ai_extensions"
    ]
  },
  {
    "key": "approvalRequired",
    "label": "Approval required",
    "type": "boolean",
    "options": [
      {
        "label": "Yes",
        "value": true
      },
      {
        "label": "No",
        "value": false
      }
    ],
    "appliesTo": [
      "auto_actions",
      "approval_queue"
    ]
  },
  {
    "key": "executionStatus",
    "label": "Execution status",
    "type": "multi_select",
    "options": [
      {
        "label": "detected",
        "value": "detected"
      },
      {
        "label": "evaluating",
        "value": "evaluating"
      },
      {
        "label": "skipped",
        "value": "skipped"
      },
      {
        "label": "pending_approval",
        "value": "pending_approval"
      },
      {
        "label": "proposed",
        "value": "proposed"
      },
      {
        "label": "executed",
        "value": "executed"
      },
      {
        "label": "failed",
        "value": "failed"
      },
      {
        "label": "cancelled",
        "value": "cancelled"
      }
    ],
    "appliesTo": [
      "execution_log"
    ]
  },
  {
    "key": "dateRange",
    "label": "Date range",
    "type": "date_range",
    "options": [],
    "appliesTo": [
      "execution_log",
      "approval_queue"
    ]
  },
  {
    "key": "incidentSeverity",
    "label": "Incident severity",
    "type": "multi_select",
    "options": [
      {
        "label": "info",
        "value": "info"
      },
      {
        "label": "warning",
        "value": "warning"
      },
      {
        "label": "high",
        "value": "high"
      },
      {
        "label": "critical",
        "value": "critical"
      }
    ],
    "appliesTo": [
      "runtime_incidents",
      "module_health",
      "runtime_guard_policies"
    ]
  },
  {
    "key": "incidentStatus",
    "label": "Incident status",
    "type": "multi_select",
    "options": [
      {
        "label": "open",
        "value": "open"
      },
      {
        "label": "acknowledged",
        "value": "acknowledged"
      },
      {
        "label": "investigating",
        "value": "investigating"
      },
      {
        "label": "mitigated",
        "value": "mitigated"
      },
      {
        "label": "resolved",
        "value": "resolved"
      },
      {
        "label": "false_positive",
        "value": "false_positive"
      }
    ],
    "appliesTo": [
      "runtime_incidents"
    ]
  },
  {
    "key": "guardAction",
    "label": "Guard action",
    "type": "multi_select",
    "options": [
      {
        "label": "log_only",
        "value": "log_only"
      },
      {
        "label": "throttle",
        "value": "throttle"
      },
      {
        "label": "limit_data",
        "value": "limit_data"
      },
      {
        "label": "set_read_only",
        "value": "set_read_only"
      },
      {
        "label": "disable_feature",
        "value": "disable_feature"
      },
      {
        "label": "open_circuit",
        "value": "open_circuit"
      },
      {
        "label": "quarantine_session",
        "value": "quarantine_session"
      },
      {
        "label": "block_request",
        "value": "block_request"
      },
      {
        "label": "create_incident",
        "value": "create_incident"
      },
      {
        "label": "notify_it_team",
        "value": "notify_it_team"
      },
      {
        "label": "notify_super_admin",
        "value": "notify_super_admin"
      },
      {
        "label": "require_manual_review",
        "value": "require_manual_review"
      },
      {
        "label": "fallback_to_cached_or_empty_state",
        "value": "fallback_to_cached_or_empty_state"
      }
    ],
    "appliesTo": [
      "runtime_incidents",
      "runtime_limits",
      "runtime_guard_policies"
    ]
  },
  {
    "key": "runtimeState",
    "label": "Runtime state",
    "type": "multi_select",
    "options": [
      {
        "label": "enabled",
        "value": "enabled"
      },
      {
        "label": "limited_mode",
        "value": "limited_mode"
      },
      {
        "label": "read_only",
        "value": "read_only"
      },
      {
        "label": "admin_only",
        "value": "admin_only"
      },
      {
        "label": "maintenance_mode",
        "value": "maintenance_mode"
      },
      {
        "label": "disabled",
        "value": "disabled"
      }
    ],
    "appliesTo": [
      "feature_flags",
      "module_health"
    ]
  },
  {
    "key": "healthStatus",
    "label": "Health status",
    "type": "multi_select",
    "options": [
      {
        "label": "healthy",
        "value": "healthy"
      },
      {
        "label": "degraded",
        "value": "degraded"
      },
      {
        "label": "limited",
        "value": "limited"
      },
      {
        "label": "unhealthy",
        "value": "unhealthy"
      },
      {
        "label": "disabled",
        "value": "disabled"
      },
      {
        "label": "maintenance",
        "value": "maintenance"
      }
    ],
    "appliesTo": [
      "module_health"
    ]
  },
  {
    "key": "performanceBudgetStatus",
    "label": "Performance budget status",
    "type": "multi_select",
    "options": [
      {
        "label": "passing",
        "value": "passing"
      },
      {
        "label": "warning",
        "value": "warning"
      },
      {
        "label": "failing",
        "value": "failing"
      },
      {
        "label": "not_tested",
        "value": "not_tested"
      }
    ],
    "appliesTo": [
      "performance_budgets"
    ]
  },
  {
    "key": "limitType",
    "label": "Limit type",
    "type": "multi_select",
    "options": [
      {
        "label": "request_count",
        "value": "request_count"
      },
      {
        "label": "concurrent_requests",